{
  "version": 1,
  "jobId": "job-1",
  "idempotencyKey": "event-1:reply",
  "chatId": "chat-1",
  "payload": {
    "idempotencyKey": "event-1:reply",
    "chatId": "chat-1",
    "text": "fixture",
    "format": "plain"
  },
  "priority": 0,
  "attempt": 0,
  "maxAttempts": 8,
  "createdAt": "2026-07-27T12:00:00.000Z",
  "availableAt": "2026-07-27T12:00:00.000Z"
}
